{
  "jsonrpc": "2.0",
  "id": "chat-1",
  "method": "chat.send",
  "params": {
    "contractVersion": "n2n.room.v1",
    "requestId": "22222222-2222-4222-8222-222222222222",
    "roomId": "aaaaaaaa-aaaa-4aaa-8aaa-aaaaaaaaaaaa",
    "occurredAt": "2026-09-11T12:01:00Z",
    "text": "Use JSON-RPC for room events."
  }
}
